{
  "metadata": {
    "side": "editor",
    "version": "1.0.0",
    "updated_at": "2026-08-19",
    "security_owner": "Armand Amoussou, responsable sécurité ADSUM",
    "technical_owner": "Armand Amoussou, responsable technique ADSUM",
    "environment": "production",
    "status": "en-vigueur",
    "sensitivity": "confidentiel",
    "source_of_truth": "sr-media-ai/adsum/deployment/ci-templates, chemin policies/editor-access-policy.json, branche main. Toute autre copie est vérifiée contre celle-ci par la tâche policy:drift.",
    "approval_procedure": "Tout ajout de rôle, de capacité privilégiée ou d'application interne passe par une demande de fusion relue par le responsable sécurité, distincte de la demande qui porte le code. Séparer les deux évite qu'un privilège nouveau passe dans le flot d'un changement fonctionnel.",
    "revocation_procedures": [
      {
        "trigger": "Départ d'une personne de l'entreprise éditrice",
        "action": "La ligne operateur_editeur est désactivée, ce qui coupe l'autorité à la requête suivante, et les sessions éditeur ouvertes sont fermées.",
        "maximum_delay_minutes": 60
      },
      {
        "trigger": "Soupçon de compromission d'un compte interne",
        "action": "Désactivation immédiate de l'opérateur, fermeture de toutes ses sessions, et révocation de tout accès d'assistance en cours à son nom.",
        "maximum_delay_minutes": 5
      },
      {
        "trigger": "Fin d'un accès d'assistance exceptionnel",
        "action": "L'accès expire seul à l'échéance inscrite, sans geste humain.",
        "maximum_delay_minutes": 0
      },
      {
        "trigger": "Changement de fonction interne",
        "action": "Le niveau de l'opérateur est ajusté ; les capacités retirées cessent d'être exercées dès la requête suivante, sans attendre l'expiration du jeton.",
        "maximum_delay_minutes": 1440
      }
    ],
    "compatibility": {
      "breaking_change_requires": [
        "Ajouter une capacité à un rôle éditeur est une rupture de sécurité, même quand elle paraît anodine : elle élargit ce qu'un compte compromis atteint.",
        "Retirer l'exigence de MFA sur un rôle est interdit et non simplement rupturant."
      ],
      "review_required_for": [
        "Toute modification de break_glass, qui est le seul chemin vers les données des clients.",
        "Toute modification de scope.authority_source.",
        "Tout passage de requires_approval à faux sur une action privilégiée."
      ]
    }
  },

  "scope": {
    "editor_only": true,
    "client_access_forbidden": true,
    "least_privilege": {
      "default": "deny",
      "statement": "Une capacité non accordée est refusée. Le refus par défaut compte davantage ici que côté client : un compte interne compromis n'expose pas une organisation mais le parc entier, et l'étendue du dégât est exactement l'étendue des droits inutiles."
    },
    "demonstrated_need": "Un rôle interne s'accorde sur une nécessité opérationnelle démontrée, pas sur l'ancienneté ni sur le titre. La question posée avant chaque attribution est : quelle tâche cette personne ne peut pas accomplir aujourd'hui, et cette capacité est-elle la plus étroite qui la débloque.",
    "sensitive_actions_logged": true,
    "token_audience": "adsum-editeur",
    "authority_source": {
      "table": "operateur_editeur",
      "schema": "editeur",
      "statement": "Être opérateur, c'est figurer dans cette table, et rien d'autre. Un rôle porté par le jeton ne peut pas tenir cette frontière parce que le même mot existe des deux côtés : « admin » désigne l'administrateur d'une paroisse aussi bien qu'un administrateur de la plateforme. La table vit dans le schéma de l'éditeur, hors d'atteinte de toute connexion cliente."
    }
  },

  "roles": [
    {
      "id": "editor-owner",
      "label": "Propriétaire de l'entreprise éditrice",
      "purpose": "Le compte de dernier recours. Il peut nommer et révoquer les opérateurs, et approuver ce qui exige une seconde personne. Il ne dispose d'aucun accès aux données des clients : le dernier recours porte sur la plateforme, pas sur son contenu.",
      "grants": ["editor.operateurs.nommer", "editor.operateurs.revoquer", "editor.approbation.donner", "editor.parc.consulter", "editor.finance.consulter"],
      "mfa": "obligatoire-renforce",
      "may_read_client_personal_data": false,
      "session_maximum_minutes": 240,
      "exists_in_code": false,
      "implementation_ticket": "ADSUM-EDITEUR-ROLES : le code ne connaît aujourd'hui que deux niveaux, lecture et intervention."
    },
    {
      "id": "editor-super-admin",
      "label": "Administrateur général de la plateforme",
      "purpose": "Administre la plateforme dans tous ses domaines techniques et commerciaux. Distinct du propriétaire par ce qu'il ne peut pas faire : nommer un opérateur et s'approuver lui-même.",
      "grants": ["editor.parc.consulter", "editor.tenants.creer", "editor.tenants.suspendre", "editor.tenants.reactiver", "editor.tenants.archiver", "editor.modules.gerer", "editor.catalogue.gerer", "editor.abonnements.gerer", "editor.deploiements.declencher", "editor.observabilite.consulter", "editor.incidents.gerer"],
      "mfa": "obligatoire-renforce",
      "may_read_client_personal_data": false,
      "session_maximum_minutes": 240,
      "exists_in_code": false,
      "implementation_ticket": "ADSUM-EDITEUR-ROLES"
    },
    {
      "id": "editor-platform-admin",
      "label": "Administrateur de plateforme",
      "purpose": "Cycle de vie des organisations clientes et de leurs modules. N'a ni le commerce ni la sécurité : provisionner un environnement et décider d'une offre sont deux métiers.",
      "grants": ["editor.parc.consulter", "editor.tenants.creer", "editor.tenants.preparer", "editor.tenants.activer", "editor.modules.gerer", "editor.deploiements.declencher", "editor.deploiements.consulter", "editor.observabilite.consulter"],
      "mfa": "obligatoire",
      "may_read_client_personal_data": false,
      "session_maximum_minutes": 480,
      "exists_in_code": false,
      "implementation_ticket": "ADSUM-EDITEUR-ROLES"
    },
    {
      "id": "editor-security-admin",
      "label": "Responsable sécurité de l'éditeur",
      "purpose": "Gère les accès internes, les sessions, l'authentification forte et la revue des permissions. Approuve les accès d'assistance. Ne déploie rien et ne vend rien : celui qui contrôle les accès ne doit pas être celui qui les utilise.",
      "grants": ["editor.operateurs.consulter", "editor.operateurs.revoquer", "editor.sessions.fermer", "editor.audit.consulter", "editor.permissions.revoir", "editor.approbation.donner", "editor.assistance.approuver", "editor.assistance.revoquer"],
      "mfa": "obligatoire-renforce",
      "may_read_client_personal_data": false,
      "session_maximum_minutes": 240,
      "exists_in_code": false,
      "implementation_ticket": "ADSUM-EDITEUR-ROLES"
    },
    {
      "id": "editor-sre",
      "label": "Ingénieur de fiabilité",
      "purpose": "Tient la plateforme debout : santé, incidents, files, déploiements, retours arrière. N'a aucun droit commercial : arrêter une hémorragie technique ne demande pas de modifier un contrat.",
      "grants": ["editor.observabilite.consulter", "editor.incidents.gerer", "editor.incidents.declarer", "editor.deploiements.consulter", "editor.deploiements.declencher", "editor.deploiements.revenir", "editor.taches.relancer", "editor.parc.consulter", "editor.secrets.renouveler"],
      "mfa": "obligatoire-renforce",
      "may_read_client_personal_data": false,
      "session_maximum_minutes": 480,
      "exists_in_code": false,
      "implementation_ticket": "ADSUM-EDITEUR-ROLES"
    },
    {
      "id": "editor-devops",
      "label": "Ingénieur de livraison",
      "purpose": "Construit et livre. Déclenche les déploiements et suit les migrations, sans pouvoir suspendre un client ni toucher aux accès internes.",
      "grants": ["editor.deploiements.consulter", "editor.deploiements.declencher", "editor.deploiements.revenir", "editor.observabilite.consulter", "editor.taches.consulter"],
      "mfa": "obligatoire",
      "may_read_client_personal_data": false,
      "session_maximum_minutes": 480,
      "exists_in_code": false,
      "implementation_ticket": "ADSUM-EDITEUR-ROLES"
    },
    {
      "id": "editor-support-agent",
      "label": "Agent de support",
      "purpose": "Traite les demandes des organisations clientes. Voit le fil, son objet et son auteur déclaré, jamais le dossier de la personne. Un agent qui verrait les membres d'un client aurait un droit de regard permanent que rien ne justifie.",
      "grants": ["editor.support.consulter", "editor.support.repondre", "editor.support.affecter", "editor.parc.consulter"],
      "mfa": "obligatoire",
      "may_read_client_personal_data": false,
      "session_maximum_minutes": 480,
      "exists_in_code": true,
      "code_reference": "adsum-commerce:migrations/versions/0006_operateurs_et_reservation.sql:24, niveau « lecture »"
    },
    {
      "id": "editor-support-lead",
      "label": "Responsable du support",
      "purpose": "Encadre le support : escalade, rattachement à un incident, demande d'accès d'assistance. Demande, mais n'approuve pas : l'approbation revient à la sécurité.",
      "grants": ["editor.support.consulter", "editor.support.repondre", "editor.support.affecter", "editor.support.escalader", "editor.assistance.demander", "editor.incidents.declarer", "editor.parc.consulter"],
      "mfa": "obligatoire",
      "may_read_client_personal_data": false,
      "session_maximum_minutes": 480,
      "exists_in_code": false,
      "implementation_ticket": "ADSUM-EDITEUR-ROLES"
    },
    {
      "id": "editor-commerce-admin",
      "label": "Administrateur commercial",